{
  "$schema": "./units.schema.json",
  "schemaVersion": 1,
  "description": "The unit table units.ts reads: every symbol's exact scale to SI base units, its dimension, whether it takes an SI prefix and whether it counts cycles; the SI prefixes; the refused spellings; the letters that are both a prefix and a unit; the affine temperatures; and the notes a spelling prints. A scale is an exact expression: decimal literals, names in `scales`, `pi`, and registered constants under their registry spelling (`c`, `e`, `m_u`, `M_sun`, `Msun_iau`, `ln2`; src/dimensional/constant-rows.ts), joined by `*`, optionally `/` and the denominator's factors (everything after the first `/` is the denominator, as in a unit text), each with an optional integer power `^n`. src/dimensional/exact-scale.ts reads it.",
  "scales": {
    "inch": "0.0254",
    "foot": "0.3048",
    "pound": "0.45359237",
    "standard_gravity": "9.80665",
    "lbf": "pound*standard_gravity",
    "psi": "lbf/inch^2",
    "julian_year": "365.25*86400",
    "mmHg": "133.322387415"
  },
  "prefixes": {
    "Y": "1e24",
    "Z": "1e21",
    "E": "1e18",
    "P": "1e15",
    "T": "1e12",
    "G": "1e9",
    "M": "1e6",
    "k": "1e3",
    "h": "1e2",
    "da": "1e1",
    "d": "1e-1",
    "c": "1e-2",
    "m": "1e-3",
    "u": "1e-6",
    "µ": "1e-6",
    "μ": "1e-6",
    "n": "1e-9",
    "p": "1e-12",
    "f": "1e-15",
    "a": "1e-18",
    "z": "1e-21",
    "y": "1e-24"
  },
  "units": [
    {
      "symbols": [
        "m"
      ],
      "scale": "1",
      "dimension": {
        "L": 1
      },
      "prefixable": true
    },
    {
      "symbols": [
        "g"
      ],
      "scale": "1e-3",
      "dimension": {
        "M": 1
      },
      "prefixable": true
    },
    {
      "symbols": [
        "s"
      ],
      "scale": "1",
      "dimension": {
        "T": 1
      },
      "prefixable": true
    },
    {
      "symbols": [
        "K"
      ],
      "scale": "1",
      "dimension": {
        "Theta": 1
      },
      "prefixable": true
    },
    {
      "symbols": [
        "A"
      ],
      "scale": "1",
      "dimension": {
        "I": 1
      },
      "prefixable": true
    },
    {
      "symbols": [
        "mol"
      ],
      "scale": "1",
      "dimension": {
        "N": 1
      },
      "prefixable": true
    },
    {
      "symbols": [
        "Hz"
      ],
      "scale": "1",
      "dimension": {
        "T": -1
      },
      "prefixable": true,
      "cycles": true,
      "comment": "A hertz is one cycle per second."
    },
    {
      "symbols": [
        "N"
      ],
      "scale": "1",
      "dimension": {
        "L": 1,
        "M": 1,
        "T": -2
      },
      "prefixable": true
    },
    {
      "symbols": [
        "Pa"
      ],
      "scale": "1",
      "dimension": {
        "L": -1,
        "M": 1,
        "T": -2
      },
      "prefixable": true
    },
    {
      "symbols": [
        "J"
      ],
      "scale": "1",
      "dimension": {
        "L": 2,
        "M": 1,
        "T": -2
      },
      "prefixable": true
    },
    {
      "symbols": [
        "W"
      ],
      "scale": "1",
      "dimension": {
        "L": 2,
        "M": 1,
        "T": -3
      },
      "prefixable": true
    },
    {
      "symbols": [
        "C"
      ],
      "scale": "1",
      "dimension": {
        "T": 1,
        "I": 1
      },
      "prefixable": true
    },
    {
      "symbols": [
        "V"
      ],
      "scale": "1",
      "dimension": {
        "L": 2,
        "M": 1,
        "T": -3,
        "I": -1
      },
      "prefixable": true
    },
    {
      "symbols": [
        "ohm",
        "Ω",
        "Ohm"
      ],
      "scale": "1",
      "dimension": {
        "L": 2,
        "M": 1,
        "T": -3,
        "I": -2
      },
      "prefixable": true
    },
    {
      "symbols": [
        "S"
      ],
      "scale": "1",
      "dimension": {
        "L": -2,
        "M": -1,
        "T": 3,
        "I": 2
      },
      "prefixable": true
    },
    {
      "symbols": [
        "F"
      ],
      "scale": "1",
      "dimension": {
        "L": -2,
        "M": -1,
        "T": 4,
        "I": 2
      },
      "prefixable": true
    },
    {
      "symbols": [
        "eV"
      ],
      "scale": "e",
      "dimension": {
        "L": 2,
        "M": 1,
        "T": -2
      },
      "prefixable": true,
      "comment": "The elementary charge times one volt. Takes an SI prefix, so GeV is 10^9 eV."
    },
    {
      "symbols": [
        "nat"
      ],
      "scale": "1",
      "dimension": {},
      "prefixable": false,
      "comment": "Information. A nat is the coherent dimensionless unit. Exact, so it takes no prefix."
    },
    {
      "symbols": [
        "bit"
      ],
      "scale": "ln2",
      "dimension": {},
      "prefixable": false,
      "comment": "A bit is ln 2 nat. Exact, so kbit is not a kilobit."
    },
    {
      "symbols": [
        "rad"
      ],
      "scale": "1",
      "dimension": {},
      "prefixable": true
    },
    {
      "symbols": [
        "deg"
      ],
      "scale": "pi/180",
      "dimension": {},
      "prefixable": false
    },
    {
      "symbols": [
        "min"
      ],
      "scale": "60",
      "dimension": {
        "T": 1
      },
      "prefixable": false
    },
    {
      "symbols": [
        "h"
      ],
      "scale": "3600",
      "dimension": {
        "T": 1
      },
      "prefixable": false
    },
    {
      "symbols": [
        "d"
      ],
      "scale": "86400",
      "dimension": {
        "T": 1
      },
      "prefixable": false
    },
    {
      "symbols": [
        "yr"
      ],
      "scale": "julian_year",
      "dimension": {
        "T": 1
      },
      "prefixable": true,
      "comment": "The Julian year, the year the orbital evaluators take. myr is a milliyear."
    },
    {
      "symbols": [
        "au",
        "AU"
      ],
      "scale": "149597870700",
      "dimension": {
        "L": 1
      },
      "prefixable": false,
      "comment": "IAU 2012 astronomical unit, an exact metre count. AU is the same row."
    },
    {
      "symbols": [
        "Msun"
      ],
      "scale": "M_sun",
      "dimension": {
        "M": 1
      },
      "prefixable": false,
      "comment": "The solar mass the evaluators use, not the IAU nominal value."
    },
    {
      "symbols": [
        "Msun_iau"
      ],
      "scale": "Msun_iau",
      "dimension": {
        "M": 1
      },
      "prefixable": false,
      "comment": "GM_SUN_SI / G_SI, so G × Msun_iau is the IAU solar mass parameter. A ratio of two measured constants: the double the constant registry holds, not a decimal quotient."
    },
    {
      "symbols": [
        "T"
      ],
      "scale": "1",
      "dimension": {
        "M": 1,
        "T": -2,
        "I": -1
      },
      "prefixable": true,
      "comment": "Tesla. An exact T still wins over the tera prefix, so Ts is a terasecond. The prefix flag is what lets nT and uT parse."
    },
    {
      "symbols": [
        "G",
        "gauss",
        "Gauss"
      ],
      "scale": "1e-4",
      "dimension": {
        "M": 1,
        "T": -2,
        "I": -1
      },
      "prefixable": true,
      "comment": "Gauss = 10^-4 T. Exact, so GPa stays a gigapascal and bare G is the gauss. It takes an SI prefix: uG and ugauss are a microgauss."
    },
    {
      "symbols": [
        "bar"
      ],
      "scale": "1e5",
      "dimension": {
        "L": -1,
        "M": 1,
        "T": -2
      },
      "prefixable": true
    },
    {
      "symbols": [
        "atm"
      ],
      "scale": "101325",
      "dimension": {
        "L": -1,
        "M": 1,
        "T": -2
      },
      "prefixable": false
    },
    {
      "symbols": [
        "angstrom",
        "Angstrom",
        "Å"
      ],
      "scale": "1e-10",
      "dimension": {
        "L": 1
      },
      "prefixable": false
    },
    {
      "symbols": [
        "pc"
      ],
      "scale": "3.085677581491367e16",
      "dimension": {
        "L": 1
      },
      "prefixable": true,
      "comment": "IAU-style parsec, the shortest decimal of the double 648000/π au. Prefixable, so Mpc is a megaparsec."
    },
    {
      "symbols": [
        "ly"
      ],
      "scale": "c*julian_year",
      "dimension": {
        "L": 1
      },
      "prefixable": false,
      "comment": "The light year: c times the Julian year."
    },
    {
      "symbols": [
        "L",
        "l"
      ],
      "scale": "1e-3",
      "dimension": {
        "L": 3
      },
      "prefixable": true,
      "comment": "CGPM 1964: 1 L = 1 dm^3 = 10^-3 m^3 exactly. Prefixable, so mL is a millilitre. Bare mL stays the prefix; mol/mL competes with metre·litre."
    },
    {
      "symbols": [
        "cal"
      ],
      "scale": "4.184",
      "dimension": {
        "L": 2,
        "M": 1,
        "T": -2
      },
      "prefixable": true,
      "comment": "Thermochemical calorie, 4.184 J exactly (NIST). Not cal_IT = 4.1868 J. Prefixable, so kcal is 4184 J."
    },
    {
      "symbols": [
        "BTU"
      ],
      "scale": "4.1868*453.59237/1.8",
      "dimension": {
        "L": 2,
        "M": 1,
        "T": -2
      },
      "prefixable": false,
      "comment": "International Steam Table BTU: cal_IT × (lb/g) / (°F per 1.8 °C). Not the thermochemical calorie."
    },
    {
      "symbols": [
        "psi"
      ],
      "scale": "psi",
      "dimension": {
        "L": -1,
        "M": 1,
        "T": -2
      },
      "prefixable": true,
      "comment": "lbf/in^2. Prefixable: kpsi and Mpsi are engineering spellings (a kilopound and a megapound per square inch)."
    },
    {
      "symbols": [
        "torr"
      ],
      "scale": "101325/760",
      "dimension": {
        "L": -1,
        "M": 1,
        "T": -2
      },
      "prefixable": true,
      "comment": "1/760 of a standard atmosphere, exactly. Prefixable (mtorr)."
    },
    {
      "symbols": [
        "mmHg"